<?xml version="1.0" encoding="UTF-8"?>
<tns:WSMatching 
        xmlns:tns="http://www.kth.se/ict/id2208/Matching" 
        xmlns:xsi="http://www.w3.org/2001/XMLSchema-instance" 
        xsi:schemaLocation="http://www.kth.se/ict/id2208/Matching Output.xsd ">
    <tns:Macthing>
        <tns:OutputServiceName>WS_A</tns:OutputServiceName>
        <tns:InputServiceName>WS_B</tns:InputServiceName>
        <tns:MacthedOperation>
            <tns:OutputOperationName>getDrink</tns:OutputOperationName>
            <tns:InputOperationName>getWine</tns:InputOperationName>
            <tns:OpScore>0.9375</tns:OpScore>
            <tns:MacthedElement>
                <tns:OutputElement>Country</tns:OutputElement>
                <tns:InputElement>Country</tns:InputElement>
                <tns:Score>1.0</tns:Score>
            </tns:MacthedElement>
            <tns:MacthedElement>
                <tns:OutputElement>Price</tns:OutputElement>
                <tns:InputElement>Cost</tns:InputElement>
                <tns:Score>0.9</tns:Score>
            </tns:MacthedElement>
            <tns:MacthedElement>
                <tns:OutputElement>Region</tns:OutputElement>
                <tns:InputElement>Area</tns:InputElement>
                <tns:Score>0.85</tns:Score>
            </tns:MacthedElement>
            <tns:MacthedElement>
                <tns:OutputElement>Color</tns:OutputElement>
                <tns:InputElement>Colour</tns:InputElement>
                <tns:Score>1.0</tns:Score>
            </tns:MacthedElement>
        </tns:MacthedOperation>
        <tns:WsScore>0.9375</tns:WsScore>
    </tns:Macthing>
</tns:WSMatching>